{
  "run_id": "run-20260731_145000",
  "project_id": "cleverdent",
  "normalized_at": "2026-07-31T15:30:00Z",
  "total_findings": 1,
  "severity_summary": {
    "CRITICAL": 1,
    "HIGH": 0,
    "MEDIUM": 0,
    "LOW": 0,
    "INFO": 0
  },
  "findings": [
    {
      "finding_id": "FND-001",
      "rule_id": "ASRP-SEC-001",
      "title": "Hardcoded OIDC client secrets in source code",
      "engine": "ai_reviewer",
      "category": "secrets",
      "severity": "CRITICAL",
      "component_id": "dent-api-nestjs",
      "security_domain": "secrets_management",
      "review_checklist_ref": "CHK-AUTH-004",
      "remediation_ref": "REM-SEC-001",
      "stage_refs": ["2.1", "2.2", "2.3", "2.4"],
      "stage_item_ids": ["V2.10.3", "secrets_management", "ASRP-SEC-001", "CHK-AUTH-004"],
      "location": {
        "file_path": "apps/dent-login/src/config/clients/client-credentials.ts",
        "start_line": 8,
        "end_line": 8,
        "commit_sha": "head"
      },
      "evidence": {
        "code_snippet": "client_secret: 'w564rRzEjS3EjPMKAYKpXRoFqa+CEObJy79aCK6SlUQig3uZhoii3A==',",
        "message": "Multiple OIDC client secrets hardcoded in client config files"
      },
      "standard_mapping": {
        "cwe": ["CWE-798"],
        "owasp_top10_2021": ["A07:2021-Identification and Authentication Failures"],
        "asvs_v4": ["V2.10.3"]
      },
      "remediation": {
        "summary": "Move client secrets to environment variables or a secrets manager; rotate all exposed credentials"
      }
    }
  ]
}
